"text","favorited","favoriteCount","replyToSN","created","truncated","replyToSID","id","replyToUID","statusSource","screenName","retweetCount","isRetweet","retweeted","longitude","latitude"
"PLN berkomitmen untuk kerja keras mengembalikan stabilitas kelistrikan di Sulteng pasca terjadinya musibah gempa bu… https://t.co/7hV6hm3DvM",FALSE,0,NA,2018-10-16 11:13:23,TRUE,NA,"1052155540619624449",NA,"<a href=""https://ifttt.com"" rel=""nofollow"">IFTTT</a>","Iswaraiswa",0,FALSE,FALSE,NA,NA
"PLN berkomitmen untuk kerja keras mengembalikan stabilitas kelistrikan di Sulteng pasca terjadinya musibah gempa bu… https://t.co/1HSGl9Q1cH",FALSE,0,NA,2018-10-16 11:13:17,TRUE,NA,"1052155515751550976",NA,"<a href=""https://ifttt.com"" rel=""nofollow"">IFTTT</a>","FreyaFeiy",0,FALSE,FALSE,NA,NA
"PLN berkomitmen untuk kerja keras mengembalikan stabilitas kelistrikan di Sulteng pasca terjadinya musibah gempa bu… https://t.co/RaiUP8qJxA",FALSE,0,NA,2018-10-16 11:13:14,TRUE,NA,"1052155501260263429",NA,"<a href=""https://ifttt.com"" rel=""nofollow"">IFTTT</a>","QaylaQaiy",0,FALSE,FALSE,NA,NA
"PLN berkomitmen untuk kerja keras mengembalikan stabilitas kelistrikan di Sulteng pasca terjadinya musibah gempa bu… https://t.co/yHziiieJ5q",FALSE,0,NA,2018-10-16 11:13:13,TRUE,NA,"1052155499272134656",NA,"<a href=""https://ifttt.com"" rel=""nofollow"">IFTTT</a>","Clarissaklaa",0,FALSE,FALSE,NA,NA
"PLN berkomitmen untuk kerja keras mengembalikan stabilitas kelistrikan di Sulteng pasca terjadinya musibah gempa bu… https://t.co/LokAbFX8Cr",FALSE,0,NA,2018-10-16 11:13:10,TRUE,NA,"1052155486181761024",NA,"<a href=""https://ifttt.com"" rel=""nofollow"">IFTTT</a>","kinantikiinan",0,FALSE,FALSE,NA,NA
"PLN berkomitmen untuk kerja keras mengembalikan stabilitas kelistrikan di Sulteng pasca terjadinya musibah gempa bu… https://t.co/EFQ9ogYav5",FALSE,0,NA,2018-10-16 11:13:09,TRUE,NA,"1052155480406220800",NA,"<a href=""https://ifttt.com"" rel=""nofollow"">IFTTT</a>","Aurelliarely",0,FALSE,FALSE,NA,NA
"PLN berkomitmen untuk kerja keras mengembalikan stabilitas kelistrikan di Sulteng pasca terjadinya musibah gempa bu… https://t.co/mxjBIcjTke",FALSE,0,NA,2018-10-16 11:13:08,TRUE,NA,"1052155479001104384",NA,"<a href=""https://ifttt.com"" rel=""nofollow"">IFTTT</a>","Inggridriri",0,FALSE,FALSE,NA,NA
"PLN berkomitmen untuk kerja keras mengembalikan stabilitas kelistrikan di Sulteng pasca terjadinya musibah gempa bu… https://t.co/SeAHWMSWZe",FALSE,0,NA,2018-10-16 11:13:08,TRUE,NA,"1052155475565965312",NA,"<a href=""https://ifttt.com"" rel=""nofollow"">IFTTT</a>","himekaeka",0,FALSE,FALSE,NA,NA
"PLN berkomitmen untuk kerja keras mengembalikan stabilitas kelistrikan di Sulteng pasca terjadinya musibah gempa bu… https://t.co/PHlecN1oPO",FALSE,0,NA,2018-10-16 11:12:38,TRUE,NA,"1052155351511035904",NA,"<a href=""https://ifttt.com"" rel=""nofollow"">IFTTT</a>","Daviradavi",0,FALSE,FALSE,NA,NA
"PLN berkomitmen untuk kerja keras mengembalikan stabilitas kelistrikan di Sulteng pasca terjadinya musibah gempa bu… https://t.co/6AVi7Fix7z",FALSE,0,NA,2018-10-16 11:12:35,TRUE,NA,"1052155340031238144",NA,"<a href=""https://ifttt.com"" rel=""nofollow"">IFTTT</a>","EvelyneEviy",0,FALSE,FALSE,NA,NA
"PLN berkomitmen untuk kerja keras mengembalikan stabilitas kelistrikan di Sulteng pasca terjadinya musibah gempa bu… https://t.co/roOSStgN0o",FALSE,0,NA,2018-10-16 11:12:31,TRUE,NA,"1052155321471225856",NA,"<a href=""http://twitter.com/download/iphone"" rel=""nofollow"">Twitter for iPhone</a>","IndiraKamelia",0,FALSE,FALSE,NA,NA
"Presiden Minta Distribusi Logistik Korban Gempa-Tsunami Sulteng Merata https://t.co/jQod1Lusd6 https://t.co/UbRKFNjaIZ",FALSE,0,NA,2018-10-16 11:04:35,FALSE,NA,"1052153324190007296",NA,"<a href=""http://publicize.wp.com/"" rel=""nofollow"">WordPress.com</a>","Tandaseru_id",0,FALSE,FALSE,NA,NA
"Rentetan gempa bumi bermagnitudo besar diatas 7 SR di Lombok, Nusa Tenggara Barat (NTB) pada 5 dan 20 Agustus 2018,… https://t.co/jlrtD8x2XA",FALSE,0,NA,2018-10-16 10:57:42,TRUE,NA,"1052151593720864768",NA,"<a href=""http://www.facebook.com/twitter"" rel=""nofollow"">Facebook</a>","beritajatimcom",0,FALSE,FALSE,NA,NA
"Kapolda Sulteng serahkan santunan kpd personil korban gempa dan tsunami palu https://t.co/e99enjknUj",FALSE,0,NA,2018-10-16 10:55:43,FALSE,NA,"1052151094569136128",NA,"<a href=""http://twitter.com/download/android"" rel=""nofollow"">Twitter for Android</a>","humasdonggala",0,FALSE,FALSE,NA,NA
"Seleksi CPNS di Sulteng ditunda karena sejumlah wilayah terdampak bencana gempa dan tsunami. NTB tetap mengikuti ja… https://t.co/yQKA6vPln7",FALSE,2,NA,2018-10-16 10:53:13,TRUE,NA,"1052150466128240640",NA,"<a href=""https://dlvrit.com/"" rel=""nofollow"">dlvr.it</a>","kompascom",3,FALSE,FALSE,NA,NA
"Warga Terdampak Gempa Palu: Kami Berterima Kasih Kepada Wahdah #WahdahPeuli #PeduliGempaSulteng #Laziswahdah… https://t.co/XvqTRugS5U",FALSE,0,NA,2018-10-16 10:40:22,TRUE,NA,"1052147232340934656",NA,"<a href=""http://publicize.wp.com/"" rel=""nofollow"">WordPress.com</a>","wahdahjkt",0,FALSE,FALSE,NA,NA
"""Relawan PKS terus berdatangan membantu korban gempa dan tsunami di Sulteng""
- Kawilda Sulawesi DPP PKS, Aus Hidaya… https://t.co/oOtvEyG9it",FALSE,4,NA,2018-10-16 10:39:00,TRUE,NA,"1052146888969838592",NA,"<a href=""http://twittbot.net/"" rel=""nofollow"">twittbot.net</a>","pksart",1,FALSE,FALSE,NA,NA
"BMKG menyatakan berhasil memetakan poin-poin penting terkait mitigasi bencana alam, khususnya gempa bumi dan tsunam… https://t.co/8x9BcaUA9L",FALSE,8,NA,2018-10-16 10:33:03,TRUE,NA,"1052145388373729281",NA,"<a href=""https://dlvrit.com/"" rel=""nofollow"">dlvr.it</a>","kompascom",3,FALSE,FALSE,NA,NA
"Ganjar Pranowo mengajak pimpinan daerah di seluruh Indonesia untuk membantu para korban gempa bumi dan tsunami di S… https://t.co/zTHZmtvr9Z",FALSE,0,NA,2018-10-16 10:30:39,TRUE,NA,"1052144784352182272",NA,"<a href=""https://ifttt.com"" rel=""nofollow"">IFTTT</a>","pdip_tuban",0,FALSE,FALSE,NA,NA
"Ganjar Pranowo mengajak pimpinan daerah di seluruh Indonesia untuk membantu para korban gempa bumi dan tsunami di S… https://t.co/Qorj2y6F1T",FALSE,0,NA,2018-10-16 10:30:02,TRUE,NA,"1052144630140039168",NA,"<a href=""https://about.twitter.com/products/tweetdeck"" rel=""nofollow"">TweetDeck</a>","GesuriID",1,FALSE,FALSE,NA,NA
"KARPOWERSHIP INDONESIA GANDENG BAZNAS KIRIM BANTUAN KE SULTENG

Sore #sahabatBAZNAS, alhamdulillah hari ini PT Kar… https://t.co/zbWu5yVHHo",FALSE,0,NA,2018-10-16 10:29:30,TRUE,NA,"1052144494420918272",NA,"<a href=""http://instagram.com"" rel=""nofollow"">Instagram</a>","baznasindonesia",0,FALSE,FALSE,NA,NA
"Seribu narapidana belum kembali ke lapas usai gempa dan tsunami di Sulteng https://t.co/qvEPqzldY6",FALSE,1,NA,2018-10-16 10:14:11,FALSE,NA,"1052140641843441664",NA,"<a href=""https://dlvrit.com/"" rel=""nofollow"">dlvr.it</a>","merdekadotcom",0,FALSE,FALSE,NA,NA
"Salurkan Bantuan Gempa Sulteng, Kapal Kemanusiaan ACT Berlayar ke Palu https://t.co/U6HrWkjZpg",FALSE,0,NA,2018-10-16 10:00:45,FALSE,NA,"1052137263021187072",NA,"<a href=""http://twitter.com"" rel=""nofollow"">Twitter Web Client</a>","covesiacom",0,FALSE,FALSE,NA,NA
"Kementerian PUPR kini fokus untuk membersihkan puing-puing bangunan dan pepohonan yang tumbang akibat gempa bumi, t… https://t.co/hBleykIBc3",FALSE,2,NA,2018-10-16 09:51:07,TRUE,NA,"1052134837924978690",NA,"<a href=""http://twitter.com/download/android"" rel=""nofollow"">Twitter for Android</a>","InfrastrukturK1",0,FALSE,FALSE,NA,NA
"Pemerintah Bangun 1.200 Barak untuk Pengungsi Sulteng

https://t.co/Llu4xLCNhv

Pemerintah perkirakan pemulihan kem… https://t.co/ZWZyMW7KLd",FALSE,0,NA,2018-10-16 09:43:42,TRUE,NA,"1052132969928777729",NA,"<a href=""https://about.twitter.com/products/tweetdeck"" rel=""nofollow"">TweetDeck</a>","beritaKBR",2,FALSE,FALSE,NA,NA
"I liked a @YouTube video https://t.co/d0N3vZQqNO Palu sebelum GEMPA | SULTENG | Drone Aerial Video",FALSE,0,NA,2018-10-16 09:35:33,FALSE,NA,"1052130919618891776",NA,"<a href=""https://www.google.com/"" rel=""nofollow"">Google</a>","DananG_WR",0,FALSE,FALSE,NA,NA
"https://t.co/5GIvLO1JFC

Hunian Sementara untuk Korban Gempa &amp; Tsunami Sulteng Dibangun di 1.200 Titik… https://t.co/fpfornkzqo",FALSE,0,NA,2018-10-16 09:35:13,TRUE,NA,"1052130833971142656",NA,"<a href=""http://twitter.com"" rel=""nofollow"">Twitter Web Client</a>","adimu_nas",0,FALSE,FALSE,NA,NA
"Ikut Pulihkan Sulteng, MNC Peduli Bantu Korban Gempa di Sigi dan Palu
#mncpeduli
#gempasulteng

https://t.co/mu9uzDt7Vj",FALSE,0,NA,2018-10-16 09:21:38,FALSE,NA,"1052127417752535041",NA,"<a href=""https://twitter.com/adypermadi/"" rel=""nofollow"">SUV Item</a>","adypermadi",0,FALSE,FALSE,"106.8449","-6.1282"
"Sore, kami menjumpai Anda bersama #BuletinSore:

•  Setahun Menjabat,Anies Baswedan Lakukan Gusuran di 71 titik 
•… https://t.co/VXO7GxiR1A",FALSE,0,NA,2018-10-16 09:03:58,TRUE,NA,"1052122972272480256",NA,"<a href=""https://about.twitter.com/products/tweetdeck"" rel=""nofollow"">TweetDeck</a>","beritaKBR",2,FALSE,FALSE,NA,NA
"Kementerian Pekerjaan Umum dan Perumahan Rakyat kini fokus untuk membersihkan puing-puing bangunan dan pepohonan ya… https://t.co/sgLnVl6DDE",FALSE,0,NA,2018-10-16 08:59:51,TRUE,NA,"1052121935503454210",NA,"<a href=""http://twitter.com"" rel=""nofollow"">Twitter Web Client</a>","sulsel_satu",0,FALSE,FALSE,NA,NA
"Sebagai Pembina FKKP siang tadi membersamai Pengurus Forum Komunitas Kubar Peduli (FKKP) menyerahkan bantuan untuk… https://t.co/vC4SzRfIoF",FALSE,0,NA,2018-10-16 08:55:33,TRUE,NA,"1052120853830410241",NA,"<a href=""http://www.facebook.com/twitter"" rel=""nofollow"">Facebook</a>","midikubar",0,FALSE,FALSE,NA,NA
"Satbrimobda Sulteng Penuhi Air Bersih untuk Korban Gempa dan Tsunami  https://t.co/31RlP4SZLe",FALSE,1,NA,2018-10-16 08:54:24,FALSE,NA,"1052120565731868672",NA,"<a href=""http://twitter.com"" rel=""nofollow"">Twitter Web Client</a>","Polres_balangan",0,FALSE,FALSE,NA,NA
"Semoga donasi tersebut dapat memberikan meringankan beban korban bencana gempa dan tsunami Sulteng.

Kabinet Harmon… https://t.co/2RTO2cs7Ol",FALSE,1,"bemunri",2018-10-16 08:51:21,TRUE,"1052119756734521345","1052119795301199872","220605523","<a href=""http://twitter.com/download/android"" rel=""nofollow"">Twitter for Android</a>","bemunri",1,FALSE,FALSE,NA,NA
"1.185 satuan pendidikan terdampak gempa dengan tsunami di Sulteng. Kebutuhan kelas darurat 1.654 sedangkan yang ter… https://t.co/rmUbymGdqc",FALSE,0,NA,2018-10-16 08:44:06,TRUE,NA,"1052117970183307264",NA,"<a href=""http://twitter.com"" rel=""nofollow"">Twitter Web Client</a>","starjogja",0,FALSE,FALSE,NA,NA
"PENYERAHAN SANTUNAN OLEH KAPOLDA SULTENG KEPADA PERSONEL POLDA SULTENG

Kapolda Sulteng Brigjen Pol Drs. Ermi Widya… https://t.co/AQ8oqtF89j",FALSE,1,NA,2018-10-16 08:42:41,TRUE,NA,"1052117616834166784",NA,"<a href=""http://twitter.com/download/android"" rel=""nofollow"">Twitter for Android</a>","humaspolsulteng",2,FALSE,FALSE,NA,NA
"1.185 satuan pendidikan terdampak gempa dqn tsunami di Sulteng. Kebutuhan kelas darurat 1.654 sedangkan yang terpas… https://t.co/UWO018K8mV",FALSE,298,NA,2018-10-16 08:41:07,TRUE,NA,"1052117219818135553",NA,"<a href=""http://twitter.com/download/android"" rel=""nofollow"">Twitter for Android</a>","Sutopo_PN",205,FALSE,FALSE,NA,NA
"“Ketika ada musibah ini, maka kita akan dorong Dirjen Pendidikan Islam untuk menambah alokasi beasiswa untuk Palu,… https://t.co/fQvy3XlRjl",FALSE,1,NA,2018-10-16 08:37:32,TRUE,NA,"1052116320421113856",NA,"<a href=""http://www.facebook.com/twitter"" rel=""nofollow"">Facebook</a>","Rimanews",0,FALSE,FALSE,NA,NA
"Korem 091/ASN Kirim Bantuan Korban Gempa dan Tsunami di Sulteng https://t.co/28zP4Uqt0R",FALSE,0,NA,2018-10-16 08:34:07,FALSE,NA,"1052115459258998784",NA,"<a href=""http://twitter.com"" rel=""nofollow"">Twitter Web Client</a>","ChannelRedaksi",0,FALSE,FALSE,NA,NA
"Testimoni korban gempa dan tsunami Sulteng saat menerima bantuan logistik yang langsung diberikan Tim Relawan Pelin… https://t.co/Zg6eemnQMp",FALSE,3,NA,2018-10-16 08:31:34,TRUE,NA,"1052114817937375232",NA,"<a href=""http://twitter.com"" rel=""nofollow"">Twitter Web Client</a>","indonesiaport4",2,FALSE,FALSE,NA,NA
"Sebagai bentuk kepedulian, Kepolisian daerah Sulawesi Selatan (Polda Sulsel) menyalurkan bantuan kemanusiaan untuk… https://t.co/aq7uFWcTAr",FALSE,0,NA,2018-10-16 08:18:31,TRUE,NA,"1052111533851926528",NA,"<a href=""http://instagram.com"" rel=""nofollow"">Instagram</a>","SosmedMakassar",0,FALSE,FALSE,NA,NA
"Saya suka video @YouTube https://t.co/GC8nb1Jgdw Ini Ceramah Ustadz Abdul Somad [UAS] Sebelum Terjadi Gempa &amp; Tsunami Palu Sulteng",FALSE,0,NA,2018-10-16 08:16:01,FALSE,NA,"1052110903947202562",NA,"<a href=""https://www.google.com/"" rel=""nofollow"">Google</a>","Wongalit_elit",0,FALSE,FALSE,NA,NA
"KIRIMAN DARI RELAWAN KORBAN GEMPA SULTENG

DIA JIHAN, Si bidadari kecil yg tengah menikmati ujian dari Sang Khalik… https://t.co/g4VTxTT7il",FALSE,3,NA,2018-10-16 08:04:14,TRUE,NA,"1052107937236189185",NA,"<a href=""http://twitter.com/download/android"" rel=""nofollow"">Twitter for Android</a>","PonirahM",0,FALSE,FALSE,NA,NA
"IMBS Serang Gelar Baksos Peduli Gempa dan Tsunami Sulteng https://t.co/K08PYZ9Zmi https://t.co/tSv8xBOmpy",FALSE,0,NA,2018-10-16 08:00:10,FALSE,NA,"1052106917332615168",NA,"<a href=""http://publicize.wp.com/"" rel=""nofollow"">WordPress.com</a>","MajalahterasC",0,FALSE,FALSE,NA,NA
"Dampak bencana gempa,  tsunami, Sulteng per tgl 14/10/2018.

Meninggal dunia 2.095 orang ,
Luka berat 4.612 orang,… https://t.co/wwIFHVgX5k",FALSE,0,NA,2018-10-16 07:49:13,TRUE,NA,"1052104161360252932",NA,"<a href=""http://www.facebook.com/twitter"" rel=""nofollow"">Facebook</a>","agus_supri_anto",0,FALSE,FALSE,NA,NA
"Orang2 terkaya &amp; negara2 di dunia yg mau peduli berbagi dgn wrg Sulteng yg menderita trkena musibah gempa, tsunami… https://t.co/6I1DfGJVT9",FALSE,0,NA,2018-10-16 07:20:50,TRUE,NA,"1052097017306963968",NA,"<a href=""http://twitter.com/download/android"" rel=""nofollow"">Twitter for Android</a>","Pitra_PAR",0,FALSE,FALSE,NA,NA
"World Bank Berikan Dana Rp. 15 Triliun Untuk Bantu Pemulihan Pasca Gempa &amp; Tsunami Sulteng
#2019PilhJokowi https://t.co/O442QK2w7R",FALSE,0,NA,2018-10-16 07:16:45,FALSE,NA,"1052095988775583744",NA,"<a href=""http://twitter.com/download/android"" rel=""nofollow"">Twitter for Android</a>","Salmia85",0,FALSE,FALSE,NA,NA
"Pemerintah akan membangun sebanyak 1.200 Hunian Sementara (Huntara) bagi korban bencana gempa bumi dan tsunami yang… https://t.co/bHco2RCW24",FALSE,0,NA,2018-10-16 07:10:39,TRUE,NA,"1052094454616604672",NA,"<a href=""http://twitter.com/download/android"" rel=""nofollow"">Twitter for Android</a>","DidisKelana",0,FALSE,FALSE,NA,NA
"Fakta Terbaru Gempa dan Tsunami Sulteng, Anjing K9 Temukan Jasad di Reruntuhan Hotel Roa Roa -… https://t.co/nKJniQ9XEJ",FALSE,0,NA,2018-10-16 07:03:19,TRUE,NA,"1052092609714302976",NA,"<a href=""http://www.apple.com"" rel=""nofollow"">iOS</a>","rimbundoloks",0,FALSE,FALSE,NA,NA
"#bappenas percepat penanganan gempa #palu #sulteng
#palubangkit #SultengBangkit #2019PilihJokowi #Jokowi1xLagi https://t.co/ofXfCgiru8",FALSE,0,NA,2018-10-16 06:51:59,FALSE,NA,"1052089755234492416",NA,"<a href=""http://twitter.com/download/android"" rel=""nofollow"">Twitter for Android</a>","Deviasaputri6",0,FALSE,FALSE,NA,NA
"3. Rumah Senyum untuk Palu Donggala  

Material sederhana, dengan semangat yang luar biasa, bekerja sama membangun… https://t.co/d72oPLW9SS",FALSE,1,NA,2018-10-16 06:48:54,TRUE,NA,"1052088981523849216",NA,"<a href=""http://twitter.com"" rel=""nofollow"">Twitter Web Client</a>","PKPU_HI",1,FALSE,FALSE,NA,NA
"2. Rumah Senyum untuk Palu Donggala  

Hadirkan hunian sementara untuk warga terdampak bencana. Mari bantu mereka,… https://t.co/JDVsjnMq9t",FALSE,1,NA,2018-10-16 06:46:21,TRUE,NA,"1052088339627630592",NA,"<a href=""http://twitter.com"" rel=""nofollow"">Twitter Web Client</a>","PKPU_HI",1,FALSE,FALSE,NA,NA
"Bantuan korban gempa dan tsunami di (Sulteng) masih terus Mengalir https://t.co/baa0Yy7kip https://t.co/o40TqJmtyb",FALSE,0,NA,2018-10-16 06:46:16,FALSE,NA,"1052088318681378817",NA,"<a href=""http://publicize.wp.com/"" rel=""nofollow"">WordPress.com</a>","expres_media",0,FALSE,FALSE,NA,NA
"Warga Banjar Korban Gempa dan Tsunami Palu Sulteng dapat Bantuan dari Walikota https://t.co/DO1riZXbZB",FALSE,0,NA,2018-10-16 06:45:53,FALSE,NA,"1052088221998432257",NA,"<a href=""http://www.facebook.com/twitter"" rel=""nofollow"">Facebook</a>","denisupendi_",0,FALSE,FALSE,NA,NA
"@yisc_alazhar CARE goes to Palu Sulteng menyalurkan bantuan utk korban terdampak gempa dan Tsunami.  Kuy bantu saud… https://t.co/PLUEgxSCwN",FALSE,0,"yisc_alazhar",2018-10-16 06:44:37,TRUE,NA,"1052087901612204032","488244800","<a href=""http://twitter.com"" rel=""nofollow"">Twitter Web Client</a>","maalazhar",0,FALSE,FALSE,NA,NA
"5 pencuri kabel listrik milik PLN tertangkap petugas keamanan di Palu. Kelimannya mengaku bukan warga Palu dan menc… https://t.co/SzJK4MPRvQ",FALSE,13,NA,2018-10-16 06:44:05,TRUE,NA,"1052087769932025858",NA,"<a href=""https://dlvrit.com/"" rel=""nofollow"">dlvr.it</a>","kompascom",15,FALSE,FALSE,NA,NA
"Polda Sulsel Peduli Gempa dan Tsunami Sulteng III.
https://t.co/tGWCdoZ687",FALSE,0,NA,2018-10-16 06:43:46,FALSE,NA,"1052087688080252929",NA,"<a href=""http://twitter.com/download/android"" rel=""nofollow"">Twitter for Android</a>","ResJeneponto",0,FALSE,FALSE,NA,NA
"1. Rumah Senyum untuk Palu Donggala

Bersama warga setempat, relawan lokal, PKPU Human Initiative menginisiasi huni… https://t.co/KxM51LbSBi",FALSE,1,NA,2018-10-16 06:42:01,TRUE,NA,"1052087246529019904",NA,"<a href=""http://twitter.com"" rel=""nofollow"">Twitter Web Client</a>","PKPU_HI",1,FALSE,FALSE,NA,NA
"Polda Sulsel_peduli gempa dan tsunami Sulteng III.... https://t.co/NTZ2myLQSh",FALSE,0,NA,2018-10-16 06:36:38,FALSE,NA,"1052085893572382720",NA,"<a href=""http://twitter.com/download/android"" rel=""nofollow"">Twitter for Android</a>","humaspolsekup01",0,FALSE,FALSE,NA,NA
"World Bank Berikan Dana Rp. 15 Triliun Untuk Bantu Pemulihan Pasca Gempa &amp; Tsunami Sulteng
#2019TetapJokowi… https://t.co/4nSeVk9w0h",FALSE,1,NA,2018-10-16 06:34:10,TRUE,NA,"1052085273389981697",NA,"<a href=""http://twitter.com/download/android"" rel=""nofollow"">Twitter for Android</a>","MithaAy77996999",0,FALSE,FALSE,NA,NA
"Relawan Badan Penanggulangan Bencana (Baguna) PDI Perjuangan Baguna Jateng tanpa kenal lelah bergabung dgn Basarnas… https://t.co/yKEpvp58nB",FALSE,0,NA,2018-10-16 06:20:59,TRUE,NA,"1052081953346732033",NA,"<a href=""http://twitter.com/download/android"" rel=""nofollow"">Twitter for Android</a>","pdipsurakarta",0,FALSE,FALSE,NA,NA
"World Bank Berikan Dana Rp. 15 Triliun Untuk Bantu Pemulihan Pasca Gempa &amp; Tsunami Sulteng #2019PilihJokowi https://t.co/ErXyF11XVt",FALSE,1,NA,2018-10-16 06:19:24,FALSE,NA,"1052081556758528005",NA,"<a href=""http://twitter.com/download/android"" rel=""nofollow"">Twitter for Android</a>","KikiWul31616543",1,FALSE,FALSE,NA,NA
"Polda Sulsel 
peduli gempa dan tsunami Sulteng III https://t.co/MYYx7j4tYT",FALSE,0,NA,2018-10-16 06:19:08,FALSE,NA,"1052081490157166592",NA,"<a href=""http://twitter.com/download/android"" rel=""nofollow"">Twitter for Android</a>","IxPulau",0,FALSE,FALSE,NA,NA
"Bantuan korban gempa dan tsunami di (Sulteng) masih terus Mengalir https://t.co/MajiRrB3QX https://t.co/ShRaFFCHWN",FALSE,0,NA,2018-10-16 06:16:04,FALSE,NA,"1052080719495753730",NA,"<a href=""https://dlvrit.com/"" rel=""nofollow"">dlvr.it</a>","inaPOScom",0,FALSE,FALSE,NA,NA
"World Bank Berikan Dana Rp. 15 Triliun Untuk Bantu Pemulihan Pasca Gempa &amp; Tsunami Sulteng #2019tetapjokowi… https://t.co/l5cio7KVdH",FALSE,0,NA,2018-10-16 06:13:02,TRUE,NA,"1052079953687109633",NA,"<a href=""http://twitter.com/download/android"" rel=""nofollow"">Twitter for Android</a>","chindylee1",0,FALSE,FALSE,NA,NA
"Alhamdulillah TVRI Sulteng hari ini sudah mulai bersiaran. Terimakasih tim tekhnik @TVRINasional bersama kawan kawa… https://t.co/xpElP8g0ab",FALSE,48,NA,2018-10-16 06:07:17,TRUE,NA,"1052078508053168128",NA,"<a href=""http://twitter.com/download/iphone"" rel=""nofollow"">Twitter for iPhone</a>","Apni",19,FALSE,FALSE,NA,NA
"World Bank Berikan Dana Rp. 15 Triliun Untuk Bantu Pemulihan Pasca Gempa &amp; Tsunami Sulteng

#2019PilihJokowiMaruf https://t.co/eR7iCQZMSy",FALSE,0,NA,2018-10-16 06:05:10,FALSE,NA,"1052077974713905152",NA,"<a href=""http://twitter.com/download/android"" rel=""nofollow"">Twitter for Android</a>","Ilmha_Syuhada",0,FALSE,FALSE,NA,NA
"Tim #PertaminaPeduliSulteng terus mendatangi pelosok Sulteng untuk memberi bantuan logistik dan layanan kesehatan b… https://t.co/rYeGlyhM8A",FALSE,1,NA,2018-10-16 06:04:30,TRUE,NA,"1052077806056759296",NA,"<a href=""http://twitter.com"" rel=""nofollow"">Twitter Web Client</a>","pertamina",1,FALSE,FALSE,NA,NA
"World Bank Berikan Dana Rp. 15 Triliun Untuk Bantu Pemulihan Pasca Gempa &amp; Tsunami Sulteng https://t.co/4eoyqAifFO",FALSE,0,NA,2018-10-16 06:01:50,FALSE,NA,"1052077135907581953",NA,"<a href=""http://twitter.com/download/android"" rel=""nofollow"">Twitter for Android</a>","Sein_Revolusi",0,FALSE,FALSE,NA,NA
"World Bank Berikan Dana Rp. 15 Triliun Untuk Bantu Pemulihan Pasca Gempa dan Tsunami Sulteng https://t.co/boWC6zEbWQ",FALSE,1,NA,2018-10-16 06:01:04,FALSE,NA,"1052076944122994688",NA,"<a href=""http://twitter.com/download/android"" rel=""nofollow"">Twitter for Android</a>","Dadang38456326",0,FALSE,FALSE,NA,NA
"World Bank Berikan Dana Rp. 15 Triliun Untuk Bantu Pemulihan Pasca Gempa dan Tsunami Sulteng #2019PilihJokowi https://t.co/cllvggd03G",FALSE,0,NA,2018-10-16 06:00:00,FALSE,NA,"1052076674458636288",NA,"<a href=""http://twitter.com/download/android"" rel=""nofollow"">Twitter for Android</a>","idn_update",0,FALSE,FALSE,NA,NA
"Tidak sekedar tenda, tidak sekedar berdiri tanpa perencanaan, inilah klinik kesehatan PMI untuk penyintas gempa.… https://t.co/GqjqtiSaeK",FALSE,0,NA,2018-10-16 05:59:04,TRUE,NA,"1052076440072716288",NA,"<a href=""http://www.facebook.com/twitter"" rel=""nofollow"">Facebook</a>","KUjank",0,FALSE,FALSE,NA,NA
"World Bank Berikan Dana Rp. 15 Triliun Untuk Bantu Pemulihan Pasca Gempa dan Tsunami Sulteng #2019PilihJokowi https://t.co/2BTOaP1cnz",FALSE,0,NA,2018-10-16 05:35:55,FALSE,NA,"1052070614381391873",NA,"<a href=""http://twitter.com/download/android"" rel=""nofollow"">Twitter for Android</a>","Santiira2",0,FALSE,FALSE,NA,NA
"World Bank Berikan Dana Rp. 15 Triliun Untuk Bantu Pemulihan Pasca Gempa &amp; Tsunami Sulteng #2019PilihJokowi https://t.co/LwJhaNwM8g",FALSE,0,NA,2018-10-16 05:27:38,FALSE,NA,"1052068527299911680",NA,"<a href=""http://twitter.com/download/android"" rel=""nofollow"">Twitter for Android</a>","Fatmafat99",0,FALSE,FALSE,NA,NA
"Ini alasan pemerintah bangun hunian sementara buat korban gempa &amp; tsunami Sulteng https://t.co/CsTNiVFLkt https://t.co/kfn6n0bKDf",FALSE,0,NA,2018-10-16 05:23:59,FALSE,NA,"1052067609309409285",NA,"<a href=""https://dlvrit.com/"" rel=""nofollow"">dlvr.it</a>","VherryNF",0,FALSE,FALSE,NA,NA
"Duka Menteri ASEAN Untuk Korban Gempa - Tsunami Sulteng https://t.co/NOCsHkPDwj",FALSE,0,NA,2018-10-16 05:23:44,FALSE,NA,"1052067546671849472",NA,"<a href=""http://www.facebook.com/twitter"" rel=""nofollow"">Facebook</a>","ditbuflori",0,FALSE,FALSE,NA,NA
"World Bank Berikan Dana Rp. 15 Triliun Untuk Bantu Pemulihan Pasca Gempa &amp; Tsunami Sulteng https://t.co/TivaromnhR",FALSE,0,NA,2018-10-16 05:19:39,FALSE,NA,"1052066520182927360",NA,"<a href=""http://twitter.com/download/android"" rel=""nofollow"">Twitter for Android</a>","PutriCa87456428",0,FALSE,FALSE,NA,NA
"Bantuan dari IMF World Bank untuk pemulihan pasca gempa dan tsunami sulteng #2019PilihJokowi https://t.co/oJi9dIu8rY",FALSE,0,NA,2018-10-16 05:15:49,FALSE,NA,"1052065553546788864",NA,"<a href=""http://twitter.com/download/android"" rel=""nofollow"">Twitter for Android</a>","ArzanHan",0,FALSE,FALSE,NA,NA
"Ke 3 Kalinya Polda Sulsel Berangkatkan 8 Truk Logistik Untuk Korban Bencana Palu: https://t.co/Mqheud6kFS, Enrekang… https://t.co/2PJtMK2djS",FALSE,0,NA,2018-10-16 05:14:05,TRUE,NA,"1052065120212246528",NA,"<a href=""https://dlvrit.com/"" rel=""nofollow"">dlvr.it</a>","matakitaco",0,FALSE,FALSE,NA,NA
"World Bank Berikan Dana Rp. 15 Triliun Untuk Bantu Pemulihan Pasca Gempa dan Tsunami Sulteng https://t.co/yVMLC93L79",FALSE,0,NA,2018-10-16 05:00:26,FALSE,NA,"1052061683420524544",NA,"<a href=""http://twitter.com/download/iphone"" rel=""nofollow"">Twitter for iPhone</a>","bocelbelalai",0,FALSE,FALSE,NA,NA
"World Bank Berikan Dana Rp. 15 Triliun Untuk Bantu Pemulihan Pasca Gempa &amp; Tsunami Sulteng

#2019TetapJokowi… https://t.co/GIf6no0EdI",FALSE,1,NA,2018-10-16 04:59:20,TRUE,NA,"1052061405354971141",NA,"<a href=""http://twitter.com/download/android"" rel=""nofollow"">Twitter for Android</a>","Fairuz_514",0,FALSE,FALSE,NA,NA
"Ini alasan pemerintah bangun hunian sementara buat korban gempa &amp; tsunami Sulteng https://t.co/StM60c2nsE",FALSE,0,NA,2018-10-16 04:49:04,FALSE,NA,"1052058824335446016",NA,"<a href=""https://dlvrit.com/"" rel=""nofollow"">dlvr.it</a>","merdekadotcom",0,FALSE,FALSE,NA,NA
"Penanganan Gempa-Tsunami Tak Cukup oleh Pemerintah Pusat &amp; Pemprov Sulteng https://t.co/8GH5vAldEj",FALSE,0,NA,2018-10-16 04:47:05,FALSE,NA,"1052058324055678976",NA,"<a href=""https://dlvrit.com/"" rel=""nofollow"">dlvr.it</a>","soloposdotcom",0,FALSE,FALSE,NA,NA
"Klik untuk donasi - K-Poppers Bersama Korban Gempa dan Tsunami Sulteng https://t.co/9CfYNtA4bz",FALSE,0,NA,2018-10-16 04:45:49,FALSE,NA,"1052058004672180224",NA,"<a href=""http://www.facebook.com/twitter"" rel=""nofollow"">Facebook</a>","baaimraasyid",0,FALSE,FALSE,NA,NA
